{
  "map_id": "BHI-MATH-G6",
  "map_version": "2026.1",
  "locked": true,
  "curriculum_authority": "brain_heist",
  "programme": "brain_heist_international",
  "assessment_style": "international_school_admission",
  "official_affiliation": "none",
  "reference_frameworks": [
    "England National Curriculum",
    "Common Core"
  ],
  "source_references": [
    "UK Department for Education, National curriculum in England: mathematics programmes of study, key stages 1 and 2, DFE-00180-2013, updated 2021.",
    "Common Core State Standards Initiative, Grade 6 Mathematics overview and domains."
  ],
  "source_licences": [
    "Open Government Licence v3.0 for GOV.UK content, except where otherwise stated.",
    "Common Core State Standards public license for purposes supporting the Common Core State Standards Initiative."
  ],
  "copyright_policy": "original_questions_only",
  "source_review_status": "approved",
  "academic_review_status": "approved",
  "grade_stage_mapping": {
    "explicit": true,
    "school_grade": 6,
    "programme": "brain_heist_international",
    "level_definition": "Upper-primary international-school admission readiness for learners typically aged 10 to 12.",
    "rationale": "Blends secure Year 6 upper-primary expectations with internationally common Grade 6 ratio, rational-number, algebra, geometry, and statistics readiness."
  },
  "objectives": [
    {
      "school_grade": 6,
      "programme": "brain_heist_international",
      "typical_age_min": 10,
      "typical_age_max": 12,
      "subject": "maths",
      "objective_id": "BHI-MATH-G6-NUM-001",
      "strand": "Number and operations",
      "subskill": "Compare and order multi-digit whole numbers",
      "learner_can": "Compare and order multi-digit whole numbers using place value.",
      "level_definition": "Grade 6 international-school admission readiness: upper-primary fluency, application, and age-appropriate reasoning.",
      "prerequisite_definition": "Assumes secure Grade 5 whole-number, fraction, decimal, measurement, and data foundations.",
      "prerequisites": [],
      "prohibited_extensions": [
        "Do not require formal secondary-school algebraic proof.",
        "Do not require trigonometry, irrational numbers, or advanced probability.",
        "Do not rely on culturally specific knowledge unrelated to the mathematics."
      ],
      "allowed_question_types": [
        "mcq"
      ],
      "allowed_difficulties": [
        "easy"
      ],
      "allowed_cognitive_levels": [
        "understand",
        "apply"
      ],
      "source_references": [
        "England NC KS2 Year 6: Number and place value.",
        "Common Core 6.NS.B: Fluently compute with multi-digit numbers."
      ],
      "source_review_status": "approved",
      "academic_review_status": "approved"
    },
    {
      "school_grade": 6,
      "programme": "brain_heist_international",
      "typical_age_min": 10,
      "typical_age_max": 12,
      "subject": "maths",
      "objective_id": "BHI-MATH-G6-NUM-002",
      "strand": "Number and operations",
      "subskill": "Round whole numbers and decimals to a stated place",
      "learner_can": "Round whole numbers and decimals to a stated place and use rounding to estimate.",
      "level_definition": "Grade 6 international-school admission readiness: upper-primary fluency, application, and age-appropriate reasoning.",
      "prerequisite_definition": "Assumes secure Grade 5 whole-number, fraction, decimal, measurement, and data foundations.",
      "prerequisites": [],
      "prohibited_extensions": [
        "Do not require formal secondary-school algebraic proof.",
        "Do not require trigonometry, irrational numbers, or advanced probability.",
        "Do not rely on culturally specific knowledge unrelated to the mathematics."
      ],
      "allowed_question_types": [
        "mcq"
      ],
      "allowed_difficulties": [
        "easy"
      ],
      "allowed_cognitive_levels": [
        "understand",
        "apply"
      ],
      "source_references": [
        "England NC KS2 Year 6: Round any whole number to a required degree of accuracy.",
        "Common Core 6.NS.B.3: Fluently compute with multi-digit decimals."
      ],
      "source_review_status": "approved",
      "academic_review_status": "approved"
    },
    {
      "school_grade": 6,
      "programme": "brain_heist_international",
      "typical_age_min": 10,
      "typical_age_max": 12,
      "subject": "maths",
      "objective_id": "BHI-MATH-G6-NUM-003",
      "strand": "Number and operations",
      "subskill": "Multiply and divide multi-digit whole numbers",
      "learner_can": "Multiply and divide multi-digit whole numbers accurately, including interpreting remainders.",
      "level_definition": "Grade 6 international-school admission readiness: upper-primary fluency, application, and age-appropriate reasoning.",
      "prerequisite_definition": "Assumes secure Grade 5 whole-number, fraction, decimal, measurement, and data foundations.",
      "prerequisites": [
        "BHI-MATH-G6-NUM-001"
      ],
      "prohibited_extensions": [
        "Do not require formal secondary-school algebraic proof.",
        "Do not require trigonometry, irrational numbers, or advanced probability.",
        "Do not rely on culturally specific knowledge unrelated to the mathematics."
      ],
      "allowed_question_types": [
        "mcq"
      ],
      "allowed_difficulties": [
        "medium"
      ],
      "allowed_cognitive_levels": [
        "apply",
        "reason"
      ],
      "source_references": [
        "England NC KS2 Year 6: Multiply and divide multi-digit numbers.",
        "Common Core 6.NS.B.2-3: Fluently divide multi-digit numbers and compute decimals."
      ],
      "source_review_status": "approved",
      "academic_review_status": "approved"
    },
    {
      "school_grade": 6,
      "programme": "brain_heist_international",
      "typical_age_min": 10,
      "typical_age_max": 12,
      "subject": "maths",
      "objective_id": "BHI-MATH-G6-NUM-004",
      "strand": "Number and operations",
      "subskill": "Find factors, multiples, prime factors, GCF, and LCM",
      "learner_can": "Use factors, multiples, prime factorisation, greatest common factors, and least common multiples.",
      "level_definition": "Grade 6 international-school admission readiness: upper-primary fluency, application, and age-appropriate reasoning.",
      "prerequisite_definition": "Assumes secure Grade 5 whole-number, fraction, decimal, measurement, and data foundations.",
      "prerequisites": [],
      "prohibited_extensions": [
        "Do not require formal secondary-school algebraic proof.",
        "Do not require trigonometry, irrational numbers, or advanced probability.",
        "Do not rely on culturally specific knowledge unrelated to the mathematics."
      ],
      "allowed_question_types": [
        "mcq"
      ],
      "allowed_difficulties": [
        "medium"
      ],
      "allowed_cognitive_levels": [
        "understand",
        "apply",
        "reason"
      ],
      "source_references": [
        "England NC KS2 Year 6: Common factors, common multiples and prime numbers.",
        "Common Core 6.NS.B.4: Find greatest common factors and least common multiples."
      ],
      "source_review_status": "approved",
      "academic_review_status": "approved"
    },
    {
      "school_grade": 6,
      "programme": "brain_heist_international",
      "typical_age_min": 10,
      "typical_age_max": 12,
      "subject": "maths",
      "objective_id": "BHI-MATH-G6-NUM-005",
      "strand": "Number and operations",
      "subskill": "Apply order of operations with grouping and exponents",
      "learner_can": "Evaluate numerical expressions using grouping, exponents, multiplication, division, addition, and subtraction in the correct order.",
      "level_definition": "Grade 6 international-school admission readiness: upper-primary fluency, application, and age-appropriate reasoning.",
      "prerequisite_definition": "Assumes secure Grade 5 whole-number, fraction, decimal, measurement, and data foundations.",
      "prerequisites": [],
      "prohibited_extensions": [
        "Do not require formal secondary-school algebraic proof.",
        "Do not require trigonometry, irrational numbers, or advanced probability.",
        "Do not rely on culturally specific knowledge unrelated to the mathematics."
      ],
      "allowed_question_types": [
        "mcq"
      ],
      "allowed_difficulties": [
        "medium"
      ],
      "allowed_cognitive_levels": [
        "apply",
        "reason"
      ],
      "source_references": [
        "England NC KS2 Year 6: Use knowledge of order of operations.",
        "Common Core 6.EE.A.1-2: Write and evaluate numerical expressions involving whole-number exponents."
      ],
      "source_review_status": "approved",
      "academic_review_status": "approved"
    },
    {
      "school_grade": 6,
      "programme": "brain_heist_international",
      "typical_age_min": 10,
      "typical_age_max": 12,
      "subject": "maths",
      "objective_id": "BHI-MATH-G6-NUM-006",
      "strand": "Number and operations",
      "subskill": "Compare and calculate with negative integers in context",
      "learner_can": "Compare negative integers and solve age-appropriate temperature and elevation changes.",
      "level_definition": "Grade 6 international-school admission readiness: upper-primary fluency, application, and age-appropriate reasoning.",
      "prerequisite_definition": "Assumes secure Grade 5 whole-number, fraction, decimal, measurement, and data foundations.",
      "prerequisites": [],
      "prohibited_extensions": [
        "Do not require formal secondary-school algebraic proof.",
        "Do not require trigonometry, irrational numbers, or advanced probability.",
        "Do not rely on culturally specific knowledge unrelated to the mathematics."
      ],